,Date,Title,URL,Journal,Severe,Severe lower bound,Severe upper bound,Severe p-value,Severe Significant,Severe Adjusted,Severe Calculated,Fatality,Fatality lower bound,Fatality upper bound,Fatality p-value,Fatality Significant,Fatality Adjusted,Fatality Calculated,Multivariate adjustment,Design,Sample,Study population
61,2020-03-02,"Clinical features and outcomes of 221 patients with COVID-19 in Wuhan, China",https://doi.org/10.1101/2020.03.02.20030452,medRxiv,OR 4.42,2.27,8.61,<0.01,Significant,Not Adjusted,Calculated,,,,,,,,,Retrospective observational study,221,"Zhongnan Hospital of Wuhan University,  from January 2 to February 10, 2020 (followed-up through Feb 15)"
62,2020-03-02,"Clinical Characteristics of Patients with Severe Pneumonia Caused by the 2019 Novel Coronavirus in Wuhan, China",https://doi.org/10.1101/2020.03.02.20029306,medRxiv,OR 5.22,1.96,13.92,<0.01,Significant,Not Adjusted,Calculated,,,,,,,,,Cross-sectional study,110,"respiratory ICU admissions of Central Hospital of Wuhan from Jan 1-Feb 10, 2020"
63,2020-02-28,Clinical Characteristics of Coronavirus Disease 2019 in China,https://www.ncbi.nlm.nih.gov/pubmed/32109013/,New England Journal of Medicine,OR 3.53,2.08,5.99,<0.01,Significant,Not Adjusted,Calculated,,,,,,,,,Retrospective observational study,1099,"552 hospitals in China between Dec 11, 2020 to Jan 29, 2020"
64,2020-02-28,Impact of complicated myocardial injury on the clinical outcome of severe or critically ill COVID-19 patients [Zhonghua xin xue guan bing za zhi],https://www.ncbi.nlm.nih.gov/pubmed/32171190,Zhonghua Xin Xue Guan Bing Za Zhi.,,,,,,,,OR 1.14,0.39,3.35,0.81,Not Significant,Not Adjusted,Calculated,,Retrospective observational study,54,"Sino-French New City Hospital of Tongji Hospital from February 3, 2020 to February 24, 2020"
65,2020-02-28,Prognostic impact of severe / critically severe new coronavirus pneumonia patients with myocardial injury,https://doi.org/10.3760/cma.j.cn112148-20200228-00137,Zhonghua xin xue guan bing za zhi,,,,,,,,OR 1.08,0.41,2.87,0.87,Not Significant,Not Adjusted,Calculated,,Retrospective observational study,54,"Tongji Hospital, Tongji Medical College, Huazhong University of Science and Technology from February 3 to February 24, 2020"
66,2020-02-28,Clinical Characteristics of Coronavirus Disease 2019 in China,https://www.ncbi.nlm.nih.gov/pubmed/32109013/,New England Journal of Medicine,OR 2.01,1.35,2.99,<0.01,Significant,Not Adjusted,Calculated,,,,,,,,,Retrospective observational study,1099,"552 hospitals in China between Dec 11, 2020 to Jan 29, 2020"
67,2020-02-27,"Comorbidity and its impact on 1,590 patients with COVID-19 in China: A Nationwide Analysis [medrxiv]",https://doi.org/10.1101/2020.02.25.20027664,medRxiv,HR 1.58,1.07,2.32,0.02,Significant,Not Adjusted,Extracted,,,,,,,,,Retrospective observational study,1590,"575 hospitals in China, from  November 21st, 2019 to January 31st, 2020"
68,2020-02-27,"Clinical characteristics of 140 patients infected by SARS-CoV-2 in Wuhan, China",https://doi.org/10.1111/all.14238,Allergy,OR 1.89,0.91,3.94,0.09,Not Significant,Not Adjusted,Calculated,,,,,,,,,Cross-sectional study,140,"No. 7 Hospital in Wuhan from January 16 to February 3, 2020"
69,2020-02-25,"Neurological Manifestations of Hospitalized Patients with COVID-19 in Wuhan, China: a retrospective case series study",https://doi.org/10.1101/2020.02.22.20026500,medRxiv,OR 3.22,1.67,6.18,<0.01,Significant,Not Adjusted,Calculated,,,,,,,,,Case series,214,Union Hospital of Huazhong University of Science and Technology in Wuhan from 16 January to 19 February 2020
70,2020-02-23,"SARS-CoV-2 infection does not significantly cause acute renal injury: an analysis of 116 hospitalized patients with COVID-19 in a single hospital, Wuhan, China",https://doi.org/10.1101/2020.02.19.20025288,medRxiv,OR 1.47,0.42,5.14,0.55,Not Significant,Not Adjusted,Calculated,,,,,,,,,Retrospective observational study,116,"Renmin Hospital of Wuhan University from January 14 to February 13, 2020"
71,2020-02-23,"SARS-CoV-2 infection does not significantly cause acute renal injury: an analysis of 116 hospitalized patients with COVID-19 in a single hospital, Wuhan, China",https://doi.org/10.1101/2020.02.19.20025288,medRxiv,OR 0.85,0.4,1.8,0.67,Not Significant,Not Adjusted,Calculated,,,,,,,,,Retrospective observational study,116,"Renmin Hospital of Wuhan University from January 14 to February 13, 2020"
72,2020-02-23,ACP risk grade: a simple mortality index for patients with confirmed or suspected severe acute respiratory syndrome coronavirus 2 disease (COVID-19) during the early stage of outbreak in Wuhan China,https://doi.org/10.1101/2020.02.20.20025510,biorxiv_medrxiv,OR 1.58,0.93,2.69,0.09,Not Significant,Not Adjusted,Calculated,,,,,,,,,Retrospective observational study,577,"Wuhan Hankou Hospital from Jan 21 to Feb 5, 2020"
73,2020-02-23,Early Prediction of Disease Progression in 2019 Novel Coronavirus Pneumonia Patients Outside Wuhan with CT and Clinical Characteristics [medrxiv],https://doi.org/10.1101/2020.02.19.20025296,medRxiv,OR 4.93,1.54,15.82,0.01,Significant,Not Adjusted,Calculated,,,,,,,,,Retrospective observational study,224,"Third Xiangya Hospital, Changsha Public Health Treatment Center, and Second People’s Hospital of Hunan between January 17, 2020 and February 1, 2020"
74,2020-02-20,Clinical features and progression of acute respiratory distress syndrome in coronavirus disease 2019,https://doi.org/10.1101/2020.02.17.20024166,medRxiv,OR 1.64,0.74,3.65,0.22,Not Significant,Not Adjusted,Calculated,,,,,,,,,Retrospective observational study,109,"Central Hospital of Wuhan between January 2 and February 1, 2020"
75,2020-02-12,Neutrophil-to-Lymphocyte Ratio Predicts Severe Illness Patients with 2019 Novel Coronavirus in the Early Stage,https://doi.org/10.1101/2020.02.10.20021584,medRxiv,OR 3.45,0.93,12.88,0.06,Not Significant,Not Adjusted,Calculated,,,,,,,,,Prospective observational study,61,"Beijing Ditan Hospital from January 13, 2020 to January 31, 2020"
76,2020-02-09,Clinical characteristics of 2019 novel coronavirus infection in China,https://doi.org/10.1101/2020.02.06.20020974,New England Journal of Medicine,OR 2.03,1.36,3.02,<0.01,Significant,Not Adjusted,Calculated,,,,,,,,,Retrospective observational study,1099,"552 hospitals in China between Dec 11, 2020 to Jan 29, 2020"
77,2020-02-07,"Clinical Characteristics of 138 Hospitalized Patients With 2019 Novel Coronavirus-Infected Pneumonia in Wuhan, China",https://www.ncbi.nlm.nih.gov/pubmed/32031570,JAMA,OR 5.09,2.26,11.48,<0.01,Significant,Not Adjusted,Calculated,,,,,,,,,Case series,138,"Zhongnan Hospital of Wuhan University from January 1 to January 28, 2020 (followed up through February 3)"
78,1905-07-12,Clinical characteristics and outcomes of 112 cardiovascular disease patients infected by 2019-nCoV,https://doi.org/10.3760/cma.j.cn112148-20200220-00105,Chinese Journal of Cardiovascular Disease,,,,,,,,OR 1.75,0.37,8.36,0.48,Not Significant,Not Adjusted,Calculated,,Retrospective observational study,112,"West Hospital of Wuhan Union Hospital from January 20, 2020 to February 15, 2020"
79,1905-07-12,Prognostic impact of severe / critically severe new coronavirus pneumonia patients with myocardial injury,https://doi.org/10.3760/cma.j.cn112148-20200228-00137,Zhonghua xin xue guan bing za zhi,,,,,,,,OR 1.14,0.39,3.35,0.81,Not Significant,,Calculated,,Retrospective observational study,54,"Sino-French New City Campus of Tongji Hospital Affiliated to Tongji Medical College of Huazhong University of Science and Technology from February 3, 2020 to February 24, 2020"
