,Date,Study,Study Link,Journal,Population,Timeline Modeled,Baseline Scenario,With Intervention,Study Type
0,2020-04-14,A Stratified Model to Quantify the Effects of Containment Policies on the Spread of COVID-19,https://doi.org/10.1101/2020.04.10.20060681,MedRxiv,"Iran assuming 1 in 10,000 in population are infectious on day 1",first 90 days COVID-19 spread,uncontained: eventual removed ratio 65.29% maximum instantaneous infectious ration 11.03% R0 2.28,"schools, offices, and companies closed: eventual removed ratio 24.97% maximum instantaneous infectious ration 3.98% R0 1.49",Modeling Study
1,2020-04-14,A Stratified Model to Quantify the Effects of Containment Policies on the Spread of COVID-19,https://doi.org/10.1101/2020.04.10.20060681,MedRxiv,"Iran assuming 1 in 10,000 in population are infectious on day 1",first 90 days COVID-19 spread,uncontained: eventual removed ratio 65.29% maximum instantaneous infectious ration 11.03% R0 2.28,schools closed and elderly social distancing: eventual removed ratio 39.08% maximum instantaneous infectious ration 5.60% R0 1.68,Modeling Study
2,2020-04-06,Sustainable social distancing through facemask use and testing during the Covid-19 pandemic,https://doi.org/10.1101/2020.04.01.20049981,MedRxiv,10 million individuals modeled ,Unknown,R0 = 2.4 ,"20% effective social protection + 75% symptomatic population tested, treated, and isolated within 12 hrs of symptom onset: R < 1",Modeling Study 
3,2020-03-23,Interventions to mitigate early spread of SARS-CoV-2 in Singapore: a modelling study The Lancet Infectious Diseases,https://doi.org/10.1016/S1473-3099(20)30162-6,Lancet Infect Dis,Singapore,Day 80,"R0 = 1.5 270,000 people infected (7.4% population)","Quarantine + school closure + workplace distancing 1,800 infected (99.3% decrease)",Modeling Study
4,2020-03-23,Effectiveness and cost-effectiveness of public health measures to control COVID-19: a modelling study,https://doi.org/10.1101/2020.03.20.20039644,MedRxiv,Unknown,Unknown,1698±716.41 infectors with no intervention,personal protection + isolation-and-quarantine 1±0.47 infectors isolation-and-quarantine + gathering restriction 1±0.72 infectors personal protection + community containment 1±0.48 infectors personal protection + isolation-and-quarantine + gathering restriction 1±0.75 infectors,Modeling Study
5,2020-03-23,The Effectiveness of Social Distancing in Mitigating COVID-19 Spread: a modelling analysis medrxiv,https://doi.org/10.1101/2020.03.20.20040055,MedRxiv,"Newcastle, Australia",10 week model accounding for activation delays,"66% infection rate (179,788 infected individuals) - no activation delay SC = school closure CI = case isolation WN = workplace non-attendance CCR = community contact reduction","SC + CI + 50% WN + 30% CCR: 1.14% IR (3,094) SC + CI + 90% WN + 70% CCR: 0.42% IR (1,131)",Modeling Study
6,2020-03-06,Effect of non-pharmaceutical interventions for containing the COVID-19 outbreak in China,https://doi.org/10.1101/2020.03.03.20029843,MedRxiv,Mainland China,"Feb 29th, 2020","114,325 COVID-19 cases ( [IQR] 76,776 - 164,576)","without early case detection and isolation, contact reduction, and travel restriction 67-fold increase (IQR: 44 - 94) in cases ",Modeling Study
7,2020-02-11,Spatially Explicit Modeling of 2019-nCoV Epidemic Trend based on Mobile Phone Data in Mainland China,https://doi.org/10.1101/2020.02.09.20021360,MedRxiv,Mainland China ,"Feb. 11, 2020 - Mar. 12, 2020","Current trend maintained: 72,172 infected ","Expanded government control efforts: 54,348 infected ",Modeling Study 
